{
  "$schema": "https://json-schema.org/draft/2020-12/schema",
  "title": "data/site.json: la web",
  "description": "data/site.json: lo general de la web y qué sale en la home, en qué orden. VS Code lee este fichero (por el \"$schema\" de arriba del JSON) para autocompletar, explicar cada campo y subrayar lo que está mal; el build y la vista previa lo usan para revisar.",
  "type": "object",
  "required": [
    "name",
    "lists"
  ],
  "additionalProperties": false,
  "properties": {
    "$schema": {
      "type": "string"
    },
    "_": {
      "type": "string"
    },
    "url": {
      "type": "string",
      "pattern": "^https://",
      "description": "El dominio, sin barra al final: \"https://valentinbarrio.com\". Con él, Google indexa la web."
    },
    "name": {
      "type": "string",
      "description": "El nombre, arriba a la izquierda."
    },
    "tagline": {
      "type": "string",
      "description": "La línea de debajo del nombre."
    },
    "email": {
      "type": "string"
    },
    "instagram": {
      "type": "string",
      "description": "El usuario de Instagram, sin @."
    },
    "about": {
      "type": "string",
      "pattern": "^[A-Za-z0-9_-]+$",
      "description": "El proyecto que hace de \"about\": se abre al pulsar el nombre. \"_valentin\""
    },
    "lists": {
      "type": "object",
      "additionalProperties": false,
      "required": [
        "home"
      ],
      "properties": {
        "home": {
          "type": "array",
          "description": "La home, de arriba abajo: el nombre de la carpeta de cada proyecto en projects/, y entre medias los vídeos decorativos: { \"banner\": \"columna.webm\" } (en data/banners/).",
          "items": {
            "anyOf": [
              {
                "type": "string",
                "pattern": "^[A-Za-z0-9_-]+$",
                "description": "Un proyecto: el nombre de su carpeta."
              },
              {
                "type": "object",
                "additionalProperties": false,
                "required": [
                  "banner"
                ],
                "properties": {
                  "banner": {
                    "type": "string",
                    "description": "Un vídeo de data/banners/."
                  }
                }
              }
            ]
          }
        }
      }
    }
  }
}
